pp5006330022,Wolverine Burke Tee   Big,30.22
pp5003540313,Dickies Heavyweight Fleece Full Zip Hoodie Big & Tall,108.78
pp5001440786,Maidenform Pure Genius Racerback Bra - 7112,45.93
pp5006630541,Mixit Elastic Gladiator Strap Sandal,19.33
pp5005870327,Arizona Camo Cargo Pants,60.43
pp5002690051,Stafford Travel Short-Sleeve Wrinkle-Free Oxford Shirt Big & Tall,32.62
pp5006451396,Stafford Reversible Belt - Big & Tall,41.09
pp5005200033,Nunn Bush Norcross Mens Cap-Toe Oxfords,78.55
pp5006290241,Lucia  3-tier Umbrella,368.63
pp5002361245,Cathy's Concepts Personalized Bottle Opener,38.68
pp5006590382,Arizona Short-Sleeve Graphic Tee - Girls 7-16 and Plus,8.45
pp5006240715,4-pc. Vest Set - Toddler Boys 2t-5t,42.29
pp5006333870,a.n.a Grate Low-Wedge Strap Sandals,42.29
pp5004221362,Dawson Headboard and Nightstand,782.58
pp5006790746,Arizona Roll-Cuff Denim Bermuda Shorts,24.16
pp5005020123,Xersion Piped Tricot Pants,25.37
pp5006241409,Lee Total Freedom Straight-Fit Pants,30.2
pp5006331251,Disney Cars Boys Athletic Sneakers - Toddler,30.2
pp5006760355,Arizona Drawstring Denim Cargo Shorts - Boys 8-20 and Husky,20.53
pp5001700944,Precious Moments Quincinera Crown Sterling Silver Pendant Necklace,45.93
pp5005920430,NutriBullet Pro 900 Series Bullet Blender,199.42
pp5006410002,a.n.a Long-Sleeve Drop-Shoulder T-Shirt - Plus,18.12
pp5006650704,Stafford Executive Non-Iron Cotton Pinpoint Dress Shirt,36.25
pp5002370242,Florsheim Marina Mens Boat Shoes,96.68
pp5004050531,TruMiracle 1/4 CT. T.W. Diamond Round Sterling Silver Earrings,196.39
pp5004050151,Worthington Curvy Fit Pants,52.05
pp5006260029,"Margot 1"" Adjustable Curtain Rod",124.2
pp5006060298,a.n.a Marble Strap Wedge Sandals,41.39
pp5006590385,Worthington Side-Slit Pencil Skirt - Tall,35.47
pp5003690139,Seventeen ZigZag Quilt,56.78
pp5002520444,Hush Puppies Belfast Mens Slip-On Shoes,105.27
pp5006870178,a.n.a Handkerchief Tank Top - Plus,23.65
pp5004731047,Mixit Solid Knit Leggings,17.03
pp5006333489,LG ENERGY STAR Ultra Capacity French-Door 4-pc. Kitchen Package- Stainless Steel,4299.66
158cb2c,Haggar Work to Weekend Classic-Fit Flat-Front Khakis,35.47
pp5006310422,Disney Collection Short-Sleeve Frozen Dress - Girls 2-10,35.49
pp5007270071,U.S. Polo Assn. Kingston Hobo Handbag,81.14
pp5005030978,Gildan Platinum 6-pk. Crew Socks,13.25
pp5006160665,"The Rock by Starfrit 8"" Nonstick Fry Pan",53.23
pp5004710748,1/2 CT. T.W. Diamond 10K Yellow Gold Anniversary Band,887.12
pp5005630801,Xersion Open-Leg Cotton-Blend Fleece Pants,17.73
pp5007350326,Mixit Jet 3 Large 3D Flower Necklace,35.49
pp5006730132,Savvy Pillsbury Short-Sleeve Heather Tee - Big & Tall,18.12
pp5006470446,Stylus Boyfriend Twill Bermuda Shorts,43.51
pp5006390132,Mixit Tiara Wedge Sandals,16.91
pp5005880077,ZeroXposur Peasant Tankini Swim Top or Action Swim Shorts,38.66
pp5003670109,Flirtitude Lace-Trim Bralette,14.5
pp5006340632,Liz Claiborne Iris Ballet Flats - Wide Width,72.52
pp5005420052,Honey-Can-Do 4-Pack Folding Storage Cubes,60.43
pp5005740370,adidas 6-pk. Superlite Low-Cut Socks,18.49
pp5004450840,Lee Regular-Fit Straight-Leg Jeans,53.18
pp5006332777,LG ENERGY STAR 4.9 cu. ft. High-Efficiency Mega Capacity Front Control Turbowash Washer With Steam,1195.33
pp5007170278,IZOD Pleated Tab Scooter,28.39
pp5006301093,Nike Reax Rockstar Womens Training Shoes,94.63
pp5002821122,Economy Pet Cargo Cover,71.31
pp5006370013,Mixit Side Flower Jelly Strap Sandals,18.12
1cee74d,Nike Air Monarch IV Mens Training Shoes,78.56
pp5006310422,Disney Collection Short-Sleeve Frozen Dress - Girls 2-10,36.26
pp5004910625,Classic Check Percale Duvet Cover Set,193.38
pp5004800284,Mundi Rio Leather Mini Wallet,21.15
pp5005920317,Benefit Cosmetics Do the Hoola Beyond Bronze Kit,41.09
pp5002830365,Croscill Classics Delano 2-Pack Curtain Panels,241.72
pp5007140113,Beautees 3-pc. Graphic Tank Top Print Leggings and Necklace - Girls 7-16 and Plus,35.04
pp5006950243,Worthington Sleeveless Layered Tank Top - Petite,24.16
pp5006162515,Mens 1/8 CT. T.W. White and Champagne Diamond 10K White Gold Ring,966.89
pp5005760066,Skechers Cruisin Work Relaxed Fit Slip-On Shoes,84.6
pp5002500132,Shark Navigator Lift-Away Professional Upright Vacuum Cleaner,410.93
pp5003830958,a.n.a Cropped Skinny Jeans - Tall,26.58
pp5007060217,Stylus Short-Sleeve Lace Tee - Plus,21.74
pp5004990787,Ariya Skinny Jeans - Juniors Plus,42.29
pp5005870319,1/4 CT. T.W. Diamond Inspirational 3-pc. Two-Tone Pendant Necklace Set,96.69
pp5006510930,a.n.a Foldover Wide Waistband Knit Maxi Skirt - Petites,24.16
1bc34a4,Seventeen Zebra Darling Window Treatments,36.26
pp5006150734,adidas BB9TIS Womens Basketball Shoes,71.82
pp5006150734,adidas BB9TIS Womens Basketball Shoes,71.82
pp5006331306,adidas Brand Cut Tee,21.53
pp5006331306,adidas Brand Cut Tee,21.53
pp5006331306,adidas Brand Cut Tee,21.53
pp5006331306,adidas Brand Cut Tee,21.53
pp5005942416,adidas Clima 3S Shorts,26.32
pp5005942416,adidas Clima 3S Shorts,26.32
pp5004991162,adidas climacool Boxer Briefs,22.98
pp5004991162,adidas climacool Boxer Briefs,22.98
pp5004991162,adidas climacool Boxer Briefs,22.98
pp5004991162,adidas climacool Boxer Briefs,22.98
pp5004990861,adidas climacool Crewneck T-Shirt,22.98
pp5004990861,adidas climacool Crewneck T-Shirt,22.98
pp5004990861,adidas climacool Crewneck T-Shirt,22.98
pp5004990861,adidas climacool Crewneck T-Shirt,22.98
pp5004990861,adidas climacool Crewneck T-Shirt,22.98
pp5004990861,adidas climacool Crewneck T-Shirt,22.98
pp5004990861,adidas climacool Crewneck T-Shirt,22.98
pp5004990861,adidas climacool Crewneck T-Shirt,22.98
pp5004990861,adidas climacool Crewneck T-Shirt,22.98
pp5004990861,adidas climacool Crewneck T-Shirt,22.98
pp5006291658,adidas Climacool Mesh Boxer Trunks,22.98
pp5006291658,adidas Climacool Mesh Boxer Trunks,22.98
pp5004990862,adidas climacool Midways,22.98
pp5004990862,adidas climacool Midways,22.98
pp5004990862,adidas climacool Midways,22.98
pp5004990862,adidas climacool Midways,22.98
pp5004990862,adidas climacool Midways,22.98
pp5004990862,adidas climacool Midways,22.98
pp5004990843,adidas climacool Muscle T-Shirt,22.98
pp5005071267,tarte Double-Ended Camouflage Tool,43.51
pp5005700868,tarte Etch & Sketch Double Ended Bamboo Liner Brush,18.13
pp5005080138,tarte Gifted Amazonian Clay Smart Mascara,25.38
ppr100001170,Tarteist Glossy Lip Paint,24.17
ppr100001170,Tarteist Glossy Lip Paint,24.17
pp5006350016,Tarteist Sculpt & Slim Contour Brush,41.09
pp5005080385,tarte Limited-Edition Rainforest After Dark Colored Clay Eye & Cheek Palette,48.34
pp5005080385,tarte Limited-Edition Rainforest After Dark Colored Clay Eye & Cheek Palette,48.34
pp5005080326,tarte Maracuja C-Brighter Eye Treatment,45.93
pp5005080209,tarte Maracuja Creaseless Concealer,30.22
pp5005080290,tarte Maracuja Oil,58.01
pp5005080120,tarte Picture Perfect Duo,21.76
pp5006930322,tarte Rainforest of the Sea Double-Ended Eyeshadow Brush,29.01
pp5006930322,tarte Rainforest of the Sea Double-Ended Eyeshadow Brush,29.01
pp5006930322,tarte Rainforest of the Sea Double-Ended Eyeshadow Brush,29.01
pp5006930300,tarte Rainforest of the Sea Double-Ended Foundation Brush,41.09
pp5006930300,tarte Rainforest of the Sea Double-Ended Foundation Brush,41.09
pp5006930300,tarte Rainforest of the Sea Double-Ended Foundation Brush,41.09
pp5006930300,tarte Rainforest of the Sea Double-Ended Foundation Brush,41.09
pp5006930323,tarte Rainforest of the Sea Drench Lip Splash Lipstick,26.59
pp5006930315,tarte Rainforest of the Sea Drink Of H2O Hydrating Boost,47.14
pp5006930317,tarte Rainforest of the Sea Lip Brush,29.01
pp5006930317,tarte Rainforest of the Sea Lip Brush,29.01
pp5006930294,tarte Rainforest of the Sea Marine Boosting Mist,30.22
pp5006930320,tarte Rainforest of the Sea Quench Lip Rescue,22.96
pp5006930318,tarte Rainforest of the Sea The Airbrusher Double-Ended Concealer Brush,29.01
pp5006930318,tarte Rainforest of the Sea The Airbrusher Double-Ended Concealer Brush,29.01
pp5006930318,tarte Rainforest of the Sea The Airbrusher Double-Ended Concealer Brush,29.01
pp5006930301,tarte Rainforest of the Sea Water Foundation Broad Spectrum SPF 15,47.14
pp5005700582,tarte Tartelette Amazonian Clay Matte Eyeshadow Palette,54.39
pp5006620332,tarte Tartelette Tease,25.38
pp5006620332,tarte Tartelette Tease,25.38
pp5005701235,tarte The Sculptor Contouring Face Slenderizer,29.01
pp5005701235,tarte The Sculptor Contouring Face Slenderizer,29.01
pp5006470463,Maternity Short-Sleeve Mixed Media Knit Top,24.16
pp5006720330,Maternity Twill Bootcut Pants - Plus,39.87
pp5006820101,Worthington Long-Sleeve Essential Crewneck Sweater - Plus,6.03
pp5006120513,Stylus Twill Shorts,16.3
pp5006081758,Stylus Crossover Ankle Pants,30.2
pp5002910421,Artland Iris Set of 4 Margarita Glasses,48.33
pp5005920949,Invicta Sl Rally Mens Black Leather Strap Chronograph Watch 16012,169.62
pp5005340350,Invicta Subaqua Reserve Mens Silver-Tone Dial Stainless Steel Chronograph Watch 14034,447.84
pp5006151562,Invicta Subaqua Reserve Mens Two-Tone Strap Chronograph Sport Watch 18552,447.84
pp5007230210,Invicta Womens Angel Stainless Steel Silver Tone White Dial Bracelet Watch 18753,142.7
pp5003290342,Ireland-opoly Board Game,33.51
pp5003840701,Art.com Iris Fields Wall Tapestry,646.16
pp5002910417,Iris Set of 4 Double Old-Fashioned Glasses,47.85
pp5002910419,Iris Set of 4 Glass Goblets,71.79
pp5002910420,Iris Set of 4 Highball Glasses,47.85
pp5002910426,Iris Set of 4 Wine Glasses,71.79
pp5007100209,iRobot Roomba 860 Vacuum Cleaning Robot,598.3
pp5006680054,Iron Chef 14-pc. Kitchen Towel Set,53.84
pp5003840703,Iron Work Wall Tapestry,538.47
pp5002230027,IronSlide 2000 Ironing Board Cover,23.93
pp5004090629,Ironwood Console Table,655.15
pp5006990076,Ironwood Gourmet Rectangular Large Paddle Serving and Cutting Board,29.9
pp5006990074,Ironwood Gourmet Rectangular Small Rectangular Paddle Serving and Cutting Board,26.31
pp5006990075,Ironwood Steak Plate,29.9
pp5005330209,Isaac Fabric Lift Recliner,1970.84
pp5007090179,Isabella 2-pc. Long-Sleeve Jacquard Skirt Set - Plus,95.72
pp5003910604,Island Shores Graphic Tee,11.95
pp5006240654,Island Shores Rayon Printed Camp Shirt,26.31
pp5006230281,Island Shores Short-Sleeve Button-Front Shirt,15.54
pp5004451437,Island Shores Short-Sleeve Silk Jacquard Shirt,28.71
pp5004800274,Iso-Cool Avela Memory Foam Mattress Topper,358.98
pp5006440857,Isotoner Micro Terry Stripe Slide Slippers,28.72
pp5006440858,Isotoner Micro Terry Thong Slippers,28.72
pp5005920512,Isotoner Smartouch Brushed Microsuede Texting Gloves,22.02
pp5005920556,Isotoner SmarTouch Brushed Microsuede Texting Gloves,27.51
pp5005701706,Isotoner SmarTouch Stretch Fleece Gloves,50.26
pp5003960019,"Isotonic 7-Zone 1½"" Memory Foam Mattress Topper",47.85
1841509,"Isotonic Iso-Cool 3"" Memory Foam Mattress Topper",287.18
18414a8,Isotonic Iso-Cool Memory Foam Contour Pillow,64.61
18414a8,Isotonic Iso-Cool Memory Foam Contour Pillow,64.61
pp5003161223,Isotonic Iso-Cool Side-Sleeper Memory Foam Pillow,83.75
pp5003161223,Isotonic Iso-Cool Side-Sleeper Memory Foam Pillow,83.75
1d396ef,Isotonic IsoLoft Memory Fiber Pillow,71.79
18414f3,Isotonic Structure Memory Foam Mattress Topper,125.63
190c3cb,iTouchless 2-pk. Bag Resealer,32.3
1e20762,iTouchless 23-Gal. Hands-Free Trash Can,258.32
1e20768,iTouchless Electric Salt and Pepper Grinders,35.89
pp5005430607,It's a 10 Miracle Blowdry Volumizer - 6 oz.,15.2
pp5005430601,It's a 10 Miracle Firm Hold Gel - 5 oz.,11.99
pp5005470155,It's a 10 Miracle Leave-In Lite - 2 oz.,9.58
pp5005470149,It's a 10 Miracle Leave-In Plus Keratin - 2 oz.,11.19
pp5005470164,It's a 10 Potion 10 Miracle Styling Potion - 4.5 oz.,16
pp5005470158,It's a 10 Silk Express Miracle Silk Conditioner - 17.5 oz.,48.07
pp5005430573,It's a 10 Silk Express Miracle Silk Shampoo - 10 oz.,18.4
pp5007120310,"itsy bitsy 9"" Sterling Silver Crystals & Stars Anklet Bracelet",18.19
pp5007100030,itsy bitsy Blue Crystal and Enamel Sterling Silver Flower Toe Ring,12.44
pp5007100030,itsy bitsy Blue Crystal and Enamel Sterling Silver Flower Toe Ring,12.44
pp5007100030,itsy bitsy Blue Crystal and Enamel Sterling Silver Flower Toe Ring,12.44
pp5007100030,itsy bitsy Blue Crystal and Enamel Sterling Silver Flower Toe Ring,12.44
pp5007100030,itsy bitsy Blue Crystal and Enamel Sterling Silver Flower Toe Ring,12.44
pp5007100030,itsy bitsy Blue Crystal and Enamel Sterling Silver Flower Toe Ring,12.44
pp5007100025,itsy bitsy Clear Crystal Sterling Silver Adjustable Toe Ring,12.44
pp5005060119,itsy bitsy Crystal Sterling Silver Flower Stud Earrings,12.44
pp5007100028,itsy bitsy Sterling Silver Arrow Adjustable Toe Ring,12.44
pp5004020288,itsy bitsy Sterling Silver Crystal Horizontal Cross Midi Ring,12.44
pp5005220709,itsy bitsy Sterling Silver Dachshund Stud Earrings,12.44
pp5005220709,itsy bitsy Sterling Silver Dachshund Stud Earrings,12.44
pp5002830929,adidas 6-pk. Striped No-Show Socks,18.49
pp5005740370,adidas 6-pk. Superlite Low-Cut Socks,18.49
pp5006440515,adidas 6-pk. Superlite No-Show Socks - Girls,18.13
pp5006440519,adidas 6-pk. Superlite No-Show Socks - Girls,18.13
pp5004040326,adidas 6-pk. Superlite No-Show Socks,18.49
pp5004040333,adidas 6-pk. Superlite No-Show Socks,18.49
pp5004040333,adidas 6-pk. Superlite No-Show Socks,18.49
pp5004040333,adidas 6-pk. Superlite No-Show Socks,18.49
pp5004040333,adidas 6-pk. Superlite No-Show Socks,18.49
pp5004040333,adidas 6-pk. Superlite No-Show Socks,18.49
pp5006333664,adidas Adidas Next Level Speed 3K Boys Basketball Shoes - Little Kids/Big Kids,48.33
pp5006620437,adidas Adilette SuperCloud Plus Womens Slide Sandals,36.25
pp5006620437,adidas Adilette SuperCloud Plus Womens Slide Sandals,36.25
pp5006650057,adidas Adilette SuperCloud Plus Women's Slide Sandals,30.2
pp5006270125,adidas Adilogo Morray Tee,21.74
pp5006270125,adidas Adilogo Morray Tee,21.74
pp5006891410,adidas Adilogo Short-Sleeve Graphic Tee - Big & Tall,24.16
pp5006891410,adidas Adilogo Short-Sleeve Graphic Tee - Big & Tall,24.16
pp5006891410,adidas Adilogo Short-Sleeve Graphic Tee - Big & Tall,24.16
pp5006891410,adidas Adilogo Short-Sleeve Graphic Tee - Big & Tall,24.16
pp5006891410,adidas Adilogo Short-Sleeve Graphic Tee - Big & Tall,24.16
pp5006891410,adidas Adilogo Short-Sleeve Graphic Tee - Big & Tall,24.16
pp5006891410,adidas Adilogo Short-Sleeve Graphic Tee - Big & Tall,24.16
pp5005180447,adidas Adilogo Tee-Big & Tall,24.16
pp5005180447,adidas Adilogo Tee-Big & Tall,24.16
pp5005180447,adidas Adilogo Tee-Big & Tall,24.16
pp5005000339,adidas Adilogo Tee,30.22
pp5007070289,Clarks Leisa Cacti Q Slide Sandals - Wide Width,59.13
pp5006241539,Champion Zip-Front Fleece Hoodie - Big & Tall,24.83
pp5007230015,JF J. Ferrar Plaid Tie and Tie Bar Set - Slim,40.22
pp5003600383,Reebok Solid Tech Top,17.73
pp5005690943,Hanes Smooth Foam Wireless Bra - HU05,40.22
pp5006461380,Trukfit Stars and Truk Tee - Big & Tall,17.73
pp5007440348,Alfred Dunner St. Augustine Short-Sleeve Print Lace Top,63.87
pp5006200328,Lil' Rider Red Rocking 3-Wheel Ride-On Chopper Motorcycle,354.85
pp5002280144,Studio Arista Grommet-Top Curtain Panel,70.97
pp5005640094,Avanti Sequin Shell Tumbler,37.85
pp5004890750,Xersion Quick-Dri Graphic Tee - Boys 8-20,7.24
pp5007170085,Studio 1 Bell-Sleeve Lace Sheath Dress - Plus,72.51
pp5006710765,Arizona Short-Sleeve Solid Polo - Preschool Boys 4-7,10.87
pp5003550071,Mens 10K Two-Tone Gold 6mm Engraved Wedding Band,604.3
pp5006082475,Geneva Mens Black Leather Strap Skeleton-Look Watch,30.82
pp5006221556,Art Smith by BARSE Multi-Stone Brass Ring,181.27
pp5004020721,French Toast Bermuda Shorts - Girls 7-20 and Plus,18.13
pp5004970254,Modellista Blair Ballet Flats,48.33
pp5006281218,Arizona Plaid Cargo Shorts - Preschool Boys 4-7,18.12
pp5003970073,Converse Chuck Taylor All Star Axel Boys Sneakers - Little Kids/Big Kids,48.34
pp5006241275,"Heys Britto Butterfly 21"" Hardside Carry-On Spinner Upright Luggage",604.31
pp5007360187,Arsenal Large Sport Bag,96.69
pp5006820298,Stylus  3/4-Sleeve Peasant Shirt- Petite,15.22
pp5005791385,Free Country Colorblock Tankini Swim Top or Drawstring Shorts,32.62
pp5006330706,Marvel Captain America Kids Red Nylon Strap Watch,45.92
pp5006510922,by&by 3/4-Sleeve Button-Front Shirt,32.62
pp5005540095,Nike KO Wetland Pullover Fleece Hoodie,39.87
pp5006930269,Arizona Cutoff Hem Cropped Jeans - Juniors Plus,30.2
pp5004830096,JCPenney Home Mercury Glass Table Lamp,151.4
pp5006300271,Dockers Sport Flip-Flops,16.55
pp5005650572,First Aid Beauty Ultra Repair Pure Mineral Sunscreen Moisturizer Broad Spectrum Spf 40,35.49
pp5006153004,Arizona Skinny Stretch Corduroy Pants,59.14
pp5002930931,MarthaWindow Rhapsody Rod-Pocket Sheer Panel,28.38
pp5005310425,Sutton Bathroom Corner Wall Cabinet,177.43
pp5006152192,Tiana B. Cap-Sleeve Knit Trapeze Dress - Tall,37.84
1cb2414,Nike Dri-FIT Cotton Tee,23.65
pp5002961262,Vanity Fair Lace-Trim Briefs - 13001,11.83
pp5006162409,Cultured Freshwater Pearl and Arrow 14K Yellow Gold Open Ring,347.47
pp5005950693,"Bates 8"" Code 6 Mens Slip-Resistant Work Boots",157.12
pp5006730149,Stafford Travel Blue Windowpane Flat-Front Suit Pants - Classic Fit,66.46
pp5001720312,MUK LUKS Eric Printed Suede Slippers,43.51
pp5005870510,Xersion Quick-Dri Performance Bootcut Pant,33.83
pp5003780677,Forever Moments Pavé Clear Crystal Charm Bracelet Spacer Bead,48.33
pp5006420256,a.n.a Short-Sleeve Split-Back T-Shirt,15.7
pp5001480145,Red Kap Utility Work Pants Big & Tall,39.87
pp5005800141,Skechers Go Flex Lace-Up Shoes,84.6
pp5006500166,Worthington Sateen Pencil Skirt,24.16
pp5006462153,Ninety Six Degrees Embroidered Triangle One-Piece Swimsuit,60.42
pp5007500110,Signature Design by Ashley Barksdale Pillow,30.22
pp5003870090,Sealy Optimum Destiny Gold Memory Foam - Mattress Only,1211.04
pp5006240609,a.n.a Chance Peep Toe Pumps,71.17
pp5005080688,MAKE UP FOR EVER Kohl Pencil,21.35
pp5003230705,Cake Boss Countertop Accessories Chef's Torch,59.14
pp5005290239,Kiss Graphic Tee-Big & Tall,17.73
pp5006280988,Star Wars Short-Sleeve Love R2D2 Tee - Girls 7-16,10.44
pp5005050039,French Toast Oxford Dress Shirt - Preschool Boys 4-7,22.52
pp5006461467,Nostalgia Griddle with Warming Drawer,59.31
pp5006540745,Bombay Cowen Mirrored 2-Drawer Chest,616.79
pp5006333033,Genuine Emerald and Diamond-Accent 14K White Gold Ring,341
pp5006081861,Arizona Short-Sleeve Graphic Ringer T-Shirt,9.48
pp5005850495,MUK LUKS Opal Womens Boots,118.6
pp5005930523,Babymoov Essential Diaper Bag - Black,110.3
pp5005990293,CHI Tea Tree Oil Serum - 2 oz.,15.1
pp5006710009,Lynk Professional Roll-Out Bin Holder,85.4
pp5006741050,Zoo York Rectangle Sunglasses with Plaid Inner Temples,14.23
pp5005850901,"Croscill Classics Tucson 16"" Square Decorative Pillow",100.82
pp5006790774,a.n.a Maternity Relaxed-Fit Foldover Maxi Skirt,26.08
pp5004111367,Lee Modern Series Curvy-Fit Bootcut Trouser,41.5
pp5005941392,Genuine Blue and White Topaz Sterling Silver Heart-Shaped Ring,59.29
pp5006520045,Arizona Graphic Ringer Tee,9.48
pp5006280597,Marie Meili Envious Deep Plunge Bra,21.29
pp5006333722,HS by Happy Socks Mens Crew Socks,8.3
pp5004050308,Crystal Floral Indoor/Outdoor Round Rug,415.15
